{
  "$schema": "http://json-schema.org/draft-07/schema#",
  "type": "array",
  "items": {
    "type": "object",
    "properties": {
      "amount": {
        "type": "number",
        "minimum": 0
      },
      "base": {
        "type": "string",
        "enum": ["EUR"]
      },
      "date": {
        "type": "string",
        "format": "date"
      },
      "rates": {
        "type": "object",
        "properties": {
          "USD": {
            "type": "number"
          }
        },
        "required": ["USD"],
        "additionalProperties": false
      }
    },
    "required": ["amount", "base", "date", "rates"],
    "additionalProperties": false
  }
}
